,model,date,picture,manufacturer,class,length,height,width,picture_url,picture_thumb,description,picture_url_local,picture_thumb_local
<Peugeot_206>,Peugeot 206,1998,2001-2003 Peugeot 206 (T1) GTi 3-door hatchback 01.jpg,Peugeot,Supermini (B),3835 mm,1428 mm,1652 mm,https://upload.wikimedia.org/wikipedia/commons/2/27/2001-2003_Peugeot_206_%28T1%29_GTi_3-door_hatchback_01.jpg,https://upload.wikimedia.org/wikipedia/commons/thumb/2/27/2001-2003_Peugeot_206_%28T1%29_GTi_3-door_hatchback_01.jpg/250px-2001-2003_Peugeot_206_%28T1%29_GTi_3-door_hatchback_01.jpg,"The Peugeot 206 is a supermini car (B) that is produced by the French car manufacturer Peugeot since May 1998.
It was officially launched in September 1998 in hatchback form, which was followed by a coupé cabriolet (the 206 CC) in September 2000, a station wagon (the 206 SW) in September 2001, and a sedan version (the 206 SD) in September 2005.In November 2006, the Chinese joint venture Dongfeng Peugeot-Citroën launched a derivative version of the Peugeot 206 known as the Citroën C2, but not technically related with the European-market model.Its facelifted version was initially launched in South America in September 2008, and in China in November 2008, in hatchback, sedan and station wagon body styles, and known as the 207 Compact, and as the 207 respectively. This version was subsequently launched in Europe in February 2009, only in hatchback form and marketed as the 206+.Even though the 206 had finished production in most markets by 2010, in Europe it was available as the 206+, with front and rear styling that resembles the Peugeot 207, until 2013, whereas in South America it continued to be offered under the 207 Compact nameplate, until January 2017, and furthermore in China, both under the 207 nameplate and as the Citroën C2.The 206 is the best-selling Peugeot model of all time with 8,358,217 cars sold in 2012. Until 2016, the Peugeot 206 was still in the top 10 of used car sales in the UK comparing to other new models from other brands.",00389.jpg,00389.jpg
<Peugeot_208>,Peugeot 208,2012,"Peugeot 208 95 VTi Allure – Frontansicht, 15. September 2012, Düsseldorf.jpg",Peugeot,Supermini (B),3962 mm,1460 mm,1739 mm,https://upload.wikimedia.org/wikipedia/commons/a/af/Peugeot_208_95_VTi_Allure_%E2%80%93_Frontansicht%2C_15._September_2012%2C_D%C3%BCsseldorf.jpg,https://upload.wikimedia.org/wikipedia/commons/thumb/a/af/Peugeot_208_95_VTi_Allure_%E2%80%93_Frontansicht%2C_15._September_2012%2C_D%C3%BCsseldorf.jpg/250px-Peugeot_208_95_VTi_Allure_%E2%80%93_Frontansicht%2C_15._September_2012%2C_D%C3%BCsseldorf.jpg,"The Peugeot 208 is a supermini (B-segment in Europe) produced by the French automaker Peugeot, and unveiled at the Geneva Motor Show in March 2012. The first 208 models were three door hatchbacks produced in November 2011, at the company's new plant in Slovakia. In June 2012, as five-door hatchbacks became available, production of the 208 also commenced at Peugeot's French plants at Mulhouse, and at Poissy.",00390.jpg,00390.jpg
<Peugeot_3008>,Peugeot 3008,2009,2014 Peugeot 3008 (T8 MY13) Allure HDi wagon (2015-07-16) 01.jpg,Peugeot,C-Segment SUV,4450 mm,1639 mm,1840 mm,https://upload.wikimedia.org/wikipedia/commons/5/53/2014_Peugeot_3008_%28T8_MY13%29_Allure_HDi_wagon_%282015-07-16%29_01.jpg,https://upload.wikimedia.org/wikipedia/commons/thumb/5/53/2014_Peugeot_3008_%28T8_MY13%29_Allure_HDi_wagon_%282015-07-16%29_01.jpg/250px-2014_Peugeot_3008_%28T8_MY13%29_Allure_HDi_wagon_%282015-07-16%29_01.jpg,"The Peugeot 3008 is a compact crossover SUV unveiled by French automaker Peugeot in May 2008, and presented for the first time to the public in Dubrovnik, Croatia. It was launched in April 2009.Despite having had its styling criticised, the 3008 has been praised by automobile magazines. In January 2010, the British motoring magazine What Car? awarded it Car of the Year for 2010. It also was awarded 2010 Semperit Irish Car of the Year in Ireland. The 3008 followed up this award in 2018, by winning the Continental Irish Car of the Year.
Peugeot officially unveiled the new 3008 in May 2016, with the car being available as of January 2017. The car is due to be a new milestone for Peugeot, in its quest to become the highest selling range of vehicles in the industry. In November 2016, the new 3008 was awarded overall CarBuyer ""Car of the Year"" 2017, as well as winning best in the category of SUVs.Diesel Car Magazine awarded the 3008 the overall award of Car of the Year for 2017, as well as taking the honour of Best Medium SUV.
In March 2017, the new 3008 won European Car of the Year 2017, by a jury of 58 motoring journalists from twenty two European countries. The award came the same day that the PSA Group announced a $2.3 billion deal to buy GM's Opel division. Opel's Astra won the Car of the Year in 2016, reacted with these two awards within two years, the Peugeot Group CEO Jean-Philippe Imparato said, ""This is an alliance of winners"".",00391.jpg,00391.jpg
<Peugeot_308>,Peugeot 308,2007,2008 Peugeot 308 (T7) XS HDi 5-door hatchback (2015-07-03) 01.jpg,Peugeot,Small family car (C),4276 mm,1498 mm,1815 mm,https://upload.wikimedia.org/wikipedia/commons/0/0b/2008_Peugeot_308_%28T7%29_XS_HDi_5-door_hatchback_%282015-07-03%29_01.jpg,https://upload.wikimedia.org/wikipedia/commons/thumb/0/0b/2008_Peugeot_308_%28T7%29_XS_HDi_5-door_hatchback_%282015-07-03%29_01.jpg/250px-2008_Peugeot_308_%28T7%29_XS_HDi_5-door_hatchback_%282015-07-03%29_01.jpg,"The Peugeot 308 is a small family car produced by the French car manufacturer Peugeot. It was unveiled on 5 June 2007, and launched in September 2007. Its development code was ""Project T7"", and is the first car of the X08 generation of Peugeot models. The 308 features a range of petrol and diesel engine options. In March 2011, the 308 received a facelift, and it premiered at the Geneva Motor Show.
A second generation was unveiled in 2013, and it was awarded as the 2014 European Car of the Year.",00392.jpg,00392.jpg
<Peugeot_4008>,Peugeot 4008,2012,2014 Peugeot 4008 (MY14) Active wagon (2015-11-11) 01.jpg,Peugeot,Compact SUV,4340 mm,1632 mm,1768 mm,https://upload.wikimedia.org/wikipedia/commons/d/de/2014_Peugeot_4008_%28MY14%29_Active_wagon_%282015-11-11%29_01.jpg,https://upload.wikimedia.org/wikipedia/commons/thumb/d/de/2014_Peugeot_4008_%28MY14%29_Active_wagon_%282015-11-11%29_01.jpg/250px-2014_Peugeot_4008_%28MY14%29_Active_wagon_%282015-11-11%29_01.jpg,"The Peugeot 4008 is a compact sport utility vehicle (SUV) produced under the French marque Peugeot, which was officially introduced in September 2011. An updated 4008 will be introduced in 2020, with a coupé like design to rival cars such as the Toyota C-HR. This was confirmed by Auto Express in February 2018.
It is based on the same platform as the Mitsubishi ASX and the Citroën C4 Aircross, and was developed in collaboration with Japanese manufacturer Mitsubishi Motors. Its debut was at the Geneva Motor Show in March 2012, along with the Peugeot 208. Sales started in April 2012, with availability from May 2012. The car was replaced by the second generation Peugeot 3008 in January 2017.
The 4008 was only sold in (as of January 2014): France, Luxembourg, China, Algeria, Burkina Faso, Slovakia, Russia, Ukraine, Mongolia, Romania, Bulgaria, Germany, South Africa, Austria, Switzerland, Belgium, Spain, Norway, Baltic countries, Lebanon, Morocco, Tunisia, Chile, Argentina, New Zealand and Australia, while its related twin Citroën C4 Aircross was being sold in more countries globally, including European countries not listed above, but neither United Kingdom nor Ireland in RHD.",00393.jpg,00393.jpg
<Peugeot_407>,Peugeot 407,2004,2005 Peugeot 407 ST HDi Executive sedan (2015-07-09) 01.jpg,Peugeot,Large family car (D),4676 mm,1400 mm,1811 mm,https://upload.wikimedia.org/wikipedia/commons/f/f3/2005_Peugeot_407_ST_HDi_Executive_sedan_%282015-07-09%29_01.jpg,https://upload.wikimedia.org/wikipedia/commons/thumb/f/f3/2005_Peugeot_407_ST_HDi_Executive_sedan_%282015-07-09%29_01.jpg/250px-2005_Peugeot_407_ST_HDi_Executive_sedan_%282015-07-09%29_01.jpg,"The Peugeot 407 is a large family car produced by the French automaker Peugeot from 2003 to 2010. It is available in saloon, coupé and estate variants, with both diesel and petrol engines. The petrol engines range from 1.8 to 2.9 litres displacement, whereas the diesels range from 1.6 to 3.0 litre engines. The 407, along with the larger 607, was succeeded by the 508 in January 2011. Sales commenced in April 2004 in France.
According to the European Car of the Year website, the 407 was one of the runners up in the award in 2005.",00394.jpg,00394.jpg
<Peugeot_408>,Peugeot 408,2010,Peugeot408EW10A13White.JPG,Peugeot,Small family car (C),4680 mm,1488 mm,1820 mm,https://upload.wikimedia.org/wikipedia/commons/d/db/Peugeot408EW10A13White.JPG,https://upload.wikimedia.org/wikipedia/commons/thumb/d/db/Peugeot408EW10A13White.JPG/250px-Peugeot408EW10A13White.JPG,"The Peugeot 408 is a small family car produced by Peugeot. It was unveiled on January 25, 2010, at the Beijing Auto Show and sales began in China on April 8, 2010.  In November 2010, production of the 408 commenced in El Palomar, Buenos Aires, Argentina, with sales starting in April 2011.
Despite its name, it is not the successor to the Peugeot 407, but rather a long-wheelbase saloon version of the Peugeot 308 hatchback, primarily targeted at emerging markets such as China. The 408 is not slated for the Western European market, and not built there.  Depending on where this car is produced, there are both internal and external differences.
The front of the car is one of the visible changes, but also the low rear end is different. Indeed, in some markets, there are cars with the front of the South American version and the back of the Chinese version. Inside the vehicle, the most noticeable difference is seen at the door.",00395.jpg,00395.jpg
<Peugeot_5008>,Peugeot 5008,2009,Peugeot 5008 II.jpg,Peugeot,Compact MPV,4530 mm,1640 mm,1835 mm,https://upload.wikimedia.org/wikipedia/commons/9/93/Peugeot_5008_II.jpg,https://upload.wikimedia.org/wikipedia/commons/thumb/9/93/Peugeot_5008_II.jpg/250px-Peugeot_5008_II.jpg,"The Peugeot 5008 is a car model produced by the French manufacturer Peugeot since 2009, in two body style categories: a compact MPV until 2016, and a crossover SUV from 2017. Five and seven seat versions have been available. Its engine range mimics the Peugeot 3008.",00396.jpg,00396.jpg
<Peugeot_508>,Peugeot 508,2010,2011 Peugeot 508 Allure HDi sedan (2015-07-24) 01.jpg,Peugeot,Large family car (D),4792 mm,1456 mm,1853 mm,https://upload.wikimedia.org/wikipedia/commons/4/44/2011_Peugeot_508_Allure_HDi_sedan_%282015-07-24%29_01.jpg,https://upload.wikimedia.org/wikipedia/commons/thumb/4/44/2011_Peugeot_508_Allure_HDi_sedan_%282015-07-24%29_01.jpg/250px-2011_Peugeot_508_Allure_HDi_sedan_%282015-07-24%29_01.jpg,"The Peugeot 508 is a large family car launched in October 2010 by French automaker Peugeot, and followed by the 508 SW, an estate version, in March 2011.It replaces the Peugeot 407, as well as the larger Peugeot 607, for which no direct replacement was scheduled. It shares its platform and most engine options with the second generation Citroën C5: the two cars are produced alongside one another at the company's Rennes Plant, and in Wuhan, China, for sales inside China.At the end of 2015, Peugeot launched the new generation of 508, 508 SW and also RXH. The front of the car was redesigned, and full LED headlights are now available. New engines were also launched, for example, a new engine, front wheel drive appeared for the RXH.
The Peugeot 508 received several international awards, like the Car of the Year 2011 in Spain (award in 2012), Next Green Car Best Large Family Car 2011 for ""being spacious and well equipped, also noting that it represented excellent build quality and has the best fuel economy in its class"" (Peugeot 508 1.6 e HDi 109g CO2/km) or also Auto Zeitung Best Imported Family Car 2011 (readers votes).
The Peugeot 508 was given a facelift in November 2015, that was marked by a vertical grill, and the inclusion of the Peugeot lion in the centre of the new grill. In addition, 2015 brought a new 180 bhp 2.0 litre diesel option which can also be paired with a Hybrid4 electrical motor system, effectively making the Peugeot 508 an AWD vehicle, with combined 200 bhp.The new second generation Peugeot 508 won the ""Most Beautiful Car of The Year 2018"" on 29 January 2019 at The Hotel Invalides Paris. The award* was part of the International Automobile Festival, where the Peugeot E-Legend also won ""The Most Beautiful Concept Car of The Year"".",00397.jpg,00397.jpg
<Peugeot_607>,Peugeot 607,1999,2003 Peugeot 607 S HDI (12855130284).jpg,Peugeot,Executive car (E),4902 mm,1442 mm,1835 mm,https://upload.wikimedia.org/wikipedia/commons/6/6c/2003_Peugeot_607_S_HDI_%2812855130284%29.jpg,https://upload.wikimedia.org/wikipedia/commons/thumb/6/6c/2003_Peugeot_607_S_HDI_%2812855130284%29.jpg/250px-2003_Peugeot_607_S_HDI_%2812855130284%29.jpg,"The Peugeot 607 is an executive car produced by the French automaker Peugeot from September 1999 to June 2010.
It is known by several nicknames including a french cruiser, lion king and spaceship.
The 607, along with the smaller 407, were superseded by the 508 in March 2011.",00398.jpg,00398.jpg
<Peugeot_RCZ>,Peugeot RCZ,2009,"Peugeot RCZ (Facelift) – Frontansicht, 7. Dezember 2014, Ratingen.jpg",Peugeot,Sport compact (S),4290 mm,1359 mm,1845 mm,https://upload.wikimedia.org/wikipedia/commons/8/8c/Peugeot_RCZ_%28Facelift%29_%E2%80%93_Frontansicht%2C_7._Dezember_2014%2C_Ratingen.jpg,https://upload.wikimedia.org/wikipedia/commons/thumb/8/8c/Peugeot_RCZ_%28Facelift%29_%E2%80%93_Frontansicht%2C_7._Dezember_2014%2C_Ratingen.jpg/250px-Peugeot_RCZ_%28Facelift%29_%E2%80%93_Frontansicht%2C_7._Dezember_2014%2C_Ratingen.jpg,"The Peugeot RCZ is a sports coupé designed and marketed by Peugeot and assembled by Magna Steyr, a subsidiary of Magna International for model years 2009–2015. 
Launched into production in April 2010  and available in almost 80 countries as of 2013 (not including the US), the RCZ was formally introduced at the Frankfurt Auto Show in 2009, having debuted as the 308 RCZ concept car at the 2007 Frankfurt show. Petrol engines are based on Prince platform while diesel is part of the HDi project. RCZ was developed under code name ""T75"".The Peugeot RCZ received five successive 'Best Sports Car' awards from Diesel Car magazine and the Top Gear '2010 Coupe of the Year award'.The 30,000th RCZ was  the assembled in June 2011. The 50,000th RCZ was built on 14 February 2013 and was painted red.
After a production period of almost six years, the last Peugeot RCZ was assembled in the Magna Steyr Graz plant in September 2015.",00399.jpg,00399.jpg
<Pontiac_Solstice>,Pontiac Solstice,2004,PontiacSolstice.jpg,Pontiac,"Roadster, coupe",3993 mm,1273 mm,1811 mm,https://upload.wikimedia.org/wikipedia/commons/3/31/PontiacSolstice.jpg,https://upload.wikimedia.org/wikipedia/commons/thumb/3/31/PontiacSolstice.jpg/250px-PontiacSolstice.jpg,"The Pontiac Solstice is a sports car that was produced by Pontiac. Introduced at the 2004 North American International Auto Show, the Solstice roadster began production in Wilmington, Delaware, starting in mid-2005 for the 2006 model year. It is powered by a naturally aspirated 2.4 L I4 engine, producing 177 hp (132 kW) and 166 lb⋅ft (225 N⋅m) of torque. The exterior styling of the production Solstice is similar to that of the 2002 Solstice concept that preceded it. Production of the Solstice was to be running before summer 2005, but delays at the Wilmington plant pushed volume production to the fourth quarter.  The new hardtop targa top 2009 model was announced in mid-2008.  The Solstice uses the GM Kappa platform, which also underpins the Saturn Sky, Opel GT, and Daewoo G2X. It was the brand's first two-seater since the Pontiac Fiero was discontinued in 1988.  The Solstice was nominated for the North American Car of the Year award and Design of the Year award from the Automobile Journalists Association of Canada (AJAC) for 2006. It was a runaway hit for Pontiac, with 7,000 orders in the first 10 days of availability and 6,000 more orders before winter. Although first-year production was planned at 7,000, GM apologized to customers for delays and increased production, delivering 10,000 by March 1.
Following the 2008 economic recession, GM discontinued the Pontiac division. Production ended with the closure of the Wilmington Assembly plant in July 2009.",00400.jpg,00400.jpg
<Pontiac_Torrent>,Pontiac Torrent,2005,Pontiac Torrent -- 08-28-2009.jpg,CAMI Automotive,Mid-size crossover SUV,188.8 in,69.3 in,71.4 in,https://upload.wikimedia.org/wikipedia/commons/5/5c/Pontiac_Torrent_--_08-28-2009.jpg,https://upload.wikimedia.org/wikipedia/commons/thumb/5/5c/Pontiac_Torrent_--_08-28-2009.jpg/250px-Pontiac_Torrent_--_08-28-2009.jpg,"The Pontiac Torrent is a mid-size crossover SUV produced by General Motors for the 2006 to 2009 model years. A replacement for the Aztek, it was a mildly restyled version of the first-generation Chevrolet Equinox.
The Torrent shared its basic body structure and mechanicals with the Equinox. However, the Torrent has a different front and rear end to distinguish it visually from the Equinox. The suspension was also modified to be firmer and sportier, and the electronic power steering was recalibrated to deliver a firmer, less artificial feel. The Torrent shared the Equinox's 185 hp (138 kW; 188 PS) 3.4 L V6 with the 5-Speed Aisin AF33 automatic transmission.
Like other Pontiac models in the lineup, trim levels of the Torrent were entry-level Base, mid-level GT, and performance-oriented GXP. The GXP featured a more powerful 3.6L DOHC SFI V6 engine and a six-speed automatic transmission, along with a unique body kit and other exterior styling cues. 
The Pontiac Torrent was featured as one of the prizes in the reality television series Survivor in 2005 as well as Criss Angel Mindfreak in the same year.",00401.jpg,00401.jpg
<Porsche_911_GT3>,Porsche 911 GT3,1999,Geneva MotorShow 2013 - Porsche 911 GT3.jpg,Porsche,Sports car,174.3 in,50.2 in,69.7 in,https://upload.wikimedia.org/wikipedia/commons/f/fa/Geneva_MotorShow_2013_-_Porsche_911_GT3.jpg,https://upload.wikimedia.org/wikipedia/commons/thumb/f/fa/Geneva_MotorShow_2013_-_Porsche_911_GT3.jpg/250px-Geneva_MotorShow_2013_-_Porsche_911_GT3.jpg,"The Porsche 911 GT3 is a high-performance homologation model of the Porsche 911 sports car. It is a line of high-performance models, which began with the 1973 911 Carrera RS. The GT3, introduced in 1999, is named after the Fédération Internationale de l'Automobile (FIA) Group GT3 class, in which its racing counterpart was designed to compete.
The GT3 has had a successful racing career in the one-make national and regional Porsche Carrera Cup and GT3 Cup Challenge series, as well as the international Porsche Supercup supporting the FIA Formula 1 World Championship.",00402.jpg,00402.jpg
<Porsche_918_Spyder>,Porsche 918 Spyder,2013,Porsche 918 in motion.jpg,Porsche,Sports car (S),4643 mm,1167 mm,1940 mm,https://upload.wikimedia.org/wikipedia/commons/e/e6/Porsche_918_in_motion.jpg,https://upload.wikimedia.org/wikipedia/commons/thumb/e/e6/Porsche_918_in_motion.jpg/250px-Porsche_918_in_motion.jpg,"The Porsche 918 Spyder is a limited-production mid-engine plug-in hybrid supercar manufactured by German automobile manufacturer Porsche. The 918 Spyder is powered by a naturally aspirated 4.6 L (4,593 cc) V8 engine, developing 447 kW (608 PS; 599 hp) at 8,700 rpm, with two electric motors delivering an additional 210 kW (286 PS; 282 hp) for a combined output of 887 PS (652 kW; 875 hp) and 1,280 N⋅m (944 lbf⋅ft) of torque. The 918 Spyder's 6.8 kWh lithium-ion battery pack delivers an all-electric range of 19 km (12 mi) under the US Environmental Protection Agency's five-cycle tests.Production began on 18 September 2013, with deliveries initially scheduled to begin in December 2013, and a starting price of ~ €611,000 (US$845,000 or GB£511,000). The 918 Spyder was sold out in December 2014 and production ended in June 2015.The 918 Spyder was first shown as a concept at the 80th Geneva Motor Show in March 2010. On 28 July 2010, after 2,000 declarations of interest, the supervisory board of Porsche AG approved series development of the 918 Spyder. The production version was unveiled at the September 2013 Frankfurt Motor Show. Porsche also unveiled the RSR racing variant of the 918 at the 2011 North American International Auto Show, which combines hybrid technology first used in the 997 GT3 R Hybrid, with styling from the 918 Spyder. But that version didn't make it to production. The 918 Spyder was the second plug-in hybrid car manufactured by Porsche, after the 2014 Panamera S E-Hybrid.",00403.jpg,00403.jpg
<Porsche_991>,Porsche 991,2011,2013 Porsche 911 Carrera 4S (991) (9626546987).jpg,Porsche,Sports car (S),4491 mm,1303 mm,1808 mm,https://upload.wikimedia.org/wikipedia/commons/c/c6/2013_Porsche_911_Carrera_4S_%28991%29_%289626546987%29.jpg,https://upload.wikimedia.org/wikipedia/commons/thumb/c/c6/2013_Porsche_911_Carrera_4S_%28991%29_%289626546987%29.jpg/250px-2013_Porsche_911_Carrera_4S_%28991%29_%289626546987%29.jpg,"The Porsche 991 was the internal designation for the seventh generation of the Porsche 911 sports car, which was unveiled at the 2011 Frankfurt Motor Show on 15 September as the replacement for the 997. The 991 was an entirely new platform, only the third since the original 911 launched in 1963 (the 996 of 1999 was the second new platform). Production of the 991 generation ended on December 20, 2019, with 233,540 units produced.",00404.jpg,00404.jpg
<Porsche_Cayenne>,Porsche Cayenne,2002,2003-2006 Porsche Cayenne (9PA) S wagon 01.jpg,Porsche AG,Mid-size luxury crossover SUV,4780 mm,1705 mm,1928 mm,https://upload.wikimedia.org/wikipedia/commons/8/8f/2003-2006_Porsche_Cayenne_%289PA%29_S_wagon_01.jpg,https://upload.wikimedia.org/wikipedia/commons/thumb/8/8f/2003-2006_Porsche_Cayenne_%289PA%29_S_wagon_01.jpg/250px-2003-2006_Porsche_Cayenne_%289PA%29_S_wagon_01.jpg,"The Porsche Cayenne is a mid-size luxury crossover sport utility vehicle produced by the German manufacturer Porsche since 2002, with North American sales beginning in 2003. It is the first V8-engined vehicle built by Porsche since 1995, when the Porsche 928 was discontinued. It is also Porsche's first off-road variant vehicle since its Super and Junior tractors of the 1950s, and the first Porsche with four doors. Since 2008, all engines have featured direct injection technology.
The second-generation Cayenne (Type 92A) was unveiled at the 2010 Geneva Motor Show in March following an online reveal. The Cayenne shares its platform, body frame, doors and electronics with the similar Volkswagen Touareg and Audi Q7. The second generation received a facelift in 2014 with minor external changes, and introduced a new plug-in E-Hybrid version, with its public launch at the Paris Motor Show.",00405.jpg,00405.jpg
<Porsche_Macan>,Porsche Macan,2014,File:Porsche Macan (2015) from Stuttgart.JPG,Porsche AG,Compact luxury crossover SUV,4681 mm,1624 mm,1923 mm,https://upload.wikimedia.org/wikipedia/commons/1/1d/Porsche_Macan_%282015%29_from_Stuttgart.JPG,https://upload.wikimedia.org/wikipedia/commons/thumb/1/1d/Porsche_Macan_%282015%29_from_Stuttgart.JPG/250px-Porsche_Macan_%282015%29_from_Stuttgart.JPG,"The Porsche Macan (Type 95B) is a five-door luxury crossover SUV produced by the German car manufacturer Porsche from 2014. It is built in Leipzig, Germany. The Macan range includes many variants, including the Macan, Macan S, Macan S Diesel, Macan GTS and the Macan Turbo. The Porsche Macan shares a platform with the Audi Q5.",00406.jpg,00406.jpg
<Porsche_Panamera>,Porsche Panamera,2009,Porsche Panamera 4S front 20100428.jpg,Porsche AG,Full-size luxury car (F),4970 mm,1423 mm,1931 mm,https://upload.wikimedia.org/wikipedia/commons/7/75/Porsche_Panamera_4S_front_20100428.jpg,https://upload.wikimedia.org/wikipedia/commons/thumb/7/75/Porsche_Panamera_4S_front_20100428.jpg/250px-Porsche_Panamera_4S_front_20100428.jpg,"The Porsche Panamera is a full-sized luxury vehicle (E-segment in Europe) manufactured by the German automobile manufacturer Porsche. It is front-engined and has a rear-wheel-drive layout, with all-wheel drive versions also available.
The production version of the Porsche Panamera was unveiled at the 13th Auto Shanghai International Automobile Show in Shanghai, China, on April 2009. In 2011, hybrid and diesel versions were launched. In April 2013, a facelift to the Panamera was announced, making its debut again at the Shanghai Auto Show. A plug-in hybrid version, the Panamera S E-Hybrid, was released in the U.S. market in November 2013. The Panamera range received a re-design in 2016.",00407.jpg,00407.jpg
